{"markdown_hash":"sha256:ffffffffffffffffffffffffffffffffffffffffffffffffffffffffffffffff","projection_id":"typescript.obligation_report@1","registry_binding":{"arm_hash":"sha256:92623e9272fe929694ea063a51350740fada0879ee7ba1368af53608447cee11","arm_id":"typescript.production.v1.source@1","registry_hash":"sha256:4e4aa59c25c1c43257eb946de2aa0a99ad0ac193ad21b72a64f2163a1ec99a51","registry_id":"reviewgraphen.source_review_registry.r2","tuple_hash":"sha256:30b5b7ed971d9bad50164563cef086488781f36870e0c12863aa023bcf186a55"},"run_hash":"sha256:cccccccccccccccccccccccccccccccccccccccccccccccccccccccccccccccc","run_id":"run:fixture","schema":"reviewgraphen.generic_review_human_report.v4"}
